#CODE;ENGLISH;FRENCH;GERMAN;;SPANISH;;;;;;;;;x
EVTDESC_CHI_209_NONE;There is no nobody to hunt in the realm at the time.\nThey are either in hiding or recently avoided a duel.;Il n'y a personne pour chasser dans le royaume à ce moment-là.\nIls se cachent ou ont récemment évité un duel.;;;;;;;;;;;;x
EVTDESC_CHI_209_OK;Bounty Hunting is challenging work. I guarantee you'll not go hungry.\nBecause at the end of the day, long as there's two people left on the planet, someone is gonna want someone dead.;La chasse aux primes est un travail stimulant. Je vous garantis que vous n'aurez pas faim.\nParce qu'à la fin de la journée, tant qu'il restera deux personnes sur la planète, quelqu'un voudra tuer quelqu'un.;;;;;;;;;;;;x
EVTOPTA_CHI_209;Hunt [chivalry_hunt_target_one.GetTitledFirstName].;Chasser [chivalry_hunt_target_one.GetTitledFirstName].;;;;;;;;;;;;x
EVTOPTB_CHI_209;Hunt [chivalry_hunt_target_two.GetTitledFirstName].;Chasser [chivalry_hunt_target_two.GetTitledFirstName].;;;;;;;;;;;;x
EVTOPTC_CHI_209;Hunt [chivalry_hunt_target_three.GetTitledFirstName].;Chasser [chivalry_hunt_target_three.GetTitledFirstName].;;;;;;;;;;;;x
EVTOPTD_CHI_209;No interesting target.;Pas de cible intéressante.;;;;;;;;;;;;x

EVTDESC_CHI_401;You contact the [From.GetSocietyRank] to tell him of your plan to offer some of your lands to the order.\nHe agree to offer more men to support you against infidels and to give you a portion of the income they receive from tithe and banking in the province.;Vous contactez [From.GetSocietyRank] pour lui faire part de votre intention d'offrir certaines de vos terres à l'ordre.\n Il accepte d'offrir plus d'hommes pour vous soutenir contre les infidèles et de vous donner une partie du revenu qu'ils reçoivent de la dîme et des banques dans la province.;;;;;;;;;;;;x
EVTOPTA_CHI_401;This site should be appropriate.;Ce site devrait être approprié.;;;;;;;;;;;;x
EVTOPTB_CHI_401;It will be expensive to renovate, but these ruins should do.;Ce sera cher à rénover, mais ces ruines devraient suffire.;;;;;;;;;;;;x
EVTOPTC_CHI_401;That old castle will make for a suitable holy stronghold.;Ce vieux château fera une forteresse sainte convenable.;;;;;;;;;;;;x
EVTOPTD_CHI_401;I've changed my mind.;J'ai changé d'avis.;;;;;;;;;;;;x
EVTDESC_CHI_402;The Holy Order have finished moving the chapter elsewhere as they are no longer in control of the castle they once built here.;Le Saint Ordre a fini de déplacer le chapitre ailleurs car il n'a plus le contrôle du château qu'il avait construit ici.;;;;;;;;;;;;x
EVTOPTA_CHI_402;It was only a matter of time.;Ce n'était qu'une question de temps.;;;;;;;;;;;;x

chivalry_power_take_bounty;The Bounty Board;Le Tableau des Primes;;;;;;;;;;;;x
chivalry_power_take_bounty_desc;Attempt to find a target in the realm to hunt for money.;Tenter de trouver une cible dans le royaume afin de le chasser pour de l'argent.;;;;;;;;;;;;x
chivalry_power_take_bounty_power_desc;§PIntrigue Decision§! Look at some of the bounties available in the realm, if there is any. Hunting them will earn you Ducats¤, Prestige and §Y[From.GetSocietyCurrency]§!.;§PIntrigue Décision§! Regardez certaines des primes disponibles dans le royaume, s'il y en a. Les chasser vous rapportera des Ducats¤, du Prestige et §Y[From.GetSocietyCurrency]§!.;;;;;;;;;;;;x
chivalry_power_holy_castle;Offer land to [From.Society.GetName];Offrir un terrain à [From.Society.GetName];;;;;;;;;;;;x
chivalry_power_holy_castle_desc;You will contact the Grand Master of the [From.Society.GetName] to give them land upon which they may build a castle. It won't be under your own jurisdiction but they will offer you support when you request men from the order or if you are being besieged.\nTo give one of your own castle, use the decision available from the province where it is located.;Vous prendrez contact avec le Grand Maître de [From.Society.GetName] pour leur donner un terrain sur lequel ils pourront construire un château. Ce ne sera pas sous votre propre juridiction mais ils vous offriront leur soutien lorsque vous demanderez des hommes de l'Ordre ou si vous êtes assiégé.\nPour donner un de vos propres châteaux, utilisez la décision disponible dans la province où il est situé.;;;;;;;;;;;;x
chivalry_power_holy_castle_power_desc;§PIntrigue Decision§! Allow you to spend §Y[From.GetSocietyCurrency]§! and perhaps Ducats¤ to give some land to [From.Society.GetName]. It will bolster the province and allow them to send more men when you request it.;§PIntrigue Décision§! Vous permettre de dépenser §Y[From.GetSocietyCurrency]§! et peut-être des Ducats¤ pour donner des terres à [From.Society.GetName]. Cela renforcera la province et lui permettra d'envoyer plus d'hommes lorsque vous en ferez la demande.;;;;;;;;;;;;x
chivalry_allow_holy_castle_tooltip;No empty holding but have room to create more.;Pas d'exploitation vide mais de la place pour en créer d'autres.;;;;;;;;;;;;x
chivalry_no_holy_castle_tooltip;Any province have no holy order castle.;Toutes les provinces n'ont pas de château saint.;;;;;;;;;;;;x
chivalry_start_holy_castle_tooltip;Contact the Grand Master.;Contacter le Grand Maître.;;;;;;;;;;;;x
chivalry_power_holy_castle_province;Offer land to [From.Society.GetName];Offrir un terrain à [From.Society.GetName];;;;;;;;;;;;x
chivalry_power_holy_castle_province_desc;You will contact the Grand Master of the [From.Society.GetName] to give them land upon which they may build a castle or offer them one of yours in this province. It won't be under your own jurisdiction but they will offer you support when you request men from the order or if you are being besieged.;Vous prendrez contact avec le Grand Maître de [From.Society.GetName] pour leur donner un terrain sur lequel ils pourront construire un château ou leur offrir l'un des vôtres dans cette province. Ce ne sera pas sous votre propre juridiction mais ils vous offriront leur soutien lorsque vous demanderez des hommes de l'Ordre ou si vous êtes assiégé.;;;;;;;;;;;;x
chivalry_power_army_fighter;Raise an Army;Lever une armée;;;;;;;;;;;;x
chivalry_power_army_fighter_desc;Use your glorious deeds to rouse up the peasantry in your demesne to follow your banner, alongside anybody fighting in tournaments.\nThese armies will disband if you are not war.;Utilisez vos actions glorieuses pour réveiller la paysannerie dans votre domaine pour suivre votre bannière, aux côtés de quiconque se bat dans les tournois.\nCes armées se dissoudront si vous n'êtes pas en guerre.;;;;;;;;;;;;x
chivalry_power_army_fighter_power_desc;§PIntrigue Decision§! Spend §Y[From.GetSocietyCurrency]§! to create an army in your capital, every tournaments you have created in your demesne will spawn additional troops.;§PInteigue Décision§! Donner §Y[From.GetSocietyCurrency]§! pour créer une armée dans votre capitale, tous les tournois que vous avez créés dans votre domaine engendreront des troupes supplémentaires.;;;;;;;;;;;;x
chivalry_power_army_holy;Request Military Support;Demande de soutien militaire;;;;;;;;;;;;x
chivalry_power_army_holy_desc;If you are at war with infidels, you may request that a branch of [Root.Society.GetName] help you in your battles. The marshalls from the various holy order's castles in your demesne will send men as well.\nThese armies will disband if you are not war.;Si vous êtes en guerre contre les infidèles, vous pouvez demander qu'une branche de la [Root.Society.GetName] vous aide dans vos batailles. Les maréchaux des différents châteaux de l'ordre saint dans votre domaine enverront aussi des hommes.\nCes armées se dissoudront si vous n'êtes pas en guerre.;;;;;;;;;;;;x
chivalry_power_army_holy_power_desc;§PIntrigue Decision§! Spend §Y[From.GetSocietyCurrency]§! to create an army in your capital, only usable if you are at war with infidels.;§PIntrigue Décision§! Donner §Y[From.GetSocietyCurrency]§! pour créer une armée dans votre capitale, utilisable uniquement si vous êtes en guerre contre les infidèles.;;;;;;;;;;;;x
chivalry_show_decisions_on;- Show [From.Society.GetName]'s Decisions;- Montrer les Décisions de [From.Society.GetName];;;;;;;;;;;;x
chivalry_show_decisions_on_desc;Click to show the Society decisions.;Cliquez pour afficher les décisions de la Société.;;;;;;;;;;;;x
chivalry_show_decisions_off;- Hide [From.Society.GetName]'s Decisions;- Cacher les Décisions de [From.Society.GetName];;;;;;;;;;;;x
chivalry_show_decisions_off_desc;Click to hide the Society decisions.;Cliquez pour masquer les décisions de la Société.;;;;;;;;;;;;x

chivalry_holy_castle;Holy Order Chapter;Chapitre du Saint-Ordre;;;;;;;;;;;;x
chivalry_holy_castle_desc;This province contain a Holy Order enclave which will assist the ruler as long as they control their castle.;Cette province contient une enclave du Saint Ordre qui assistera le souverain tant qu'il contrôlera son château.;;;;;;;;;;;;x


# V replace correcty
EVTOPTC_CHI_3101;*Skip the Duel*;*Passer le Duel*;;;;;;;;;;;;x
EVTOPTB_CHI_3102;*Skip the Duel*;*Passer le Duel*;;;;;;;;;;;;x
chivalry_duel_skip;You will ignore the duel system and the result will be random based on your combat skill and traits.;Vous ignorerez le système de duels et le résultat sera aléatoire en fonction de vos compétences et traits de caractère au combat.;;;;;;;;;;;;x

EVTOPTD_CHI_3732;Trade half of the ducats for boats.;Échanger la moitié des ducats contre des bateaux.;;;;;;;;;;;;x
EVTOPTD_CHI_3735;Trade half of the ducats for boats.;Échanger la moitié des ducats contre des bateaux.;;;;;;;;;;;;x

chivalry_hired_pay_tooltip;You will receive payments based on how many battles and sieges you have won with your army as the leading army and/or with you as a flank leader.\nUnsieging your employer's provinces and attacking the armies of your target's vassals do count. Empty nomad provinces don't.\nYou can see your payments values on the description of your moblization law.\nFailure to participate will hurt your reputation.;Vous recevrez des paiements basés sur le nombre de batailles et de sièges que vous avez gagnés avec votre armée en tant que chef d'armée et/ou avec vous en tant que chef de flanc.\nDélivrer les provinces de votre souverain et attaquer les armées des vassaux de votre cible comptent. Les provinces nomades vides ne le font pas.\nVous pouvez voir la valeur de vos paiements sur la description de votre loi de mobilisation.\nSi vous ne participez pas, votre réputation en souffrira.;;;;;;;;;;;;x
